Company Name,Legal Entity Type,State,Headquarters City,Year Founded,Company Website,Logo URL,Company Description (Short),Company Description (Long),Industry Sector,Total Funding Raised (INR),Number of Funding Rounds,Latest Funding Round Type,Latest Funding Date,Lead Investors,Revenue Estimate (Annual),Valuation Estimate (if available),Number of Employees (Current),Number of Employees (Estimate Range),Key People,Founders,Board Members / Advisors,Employee Growth (YoY %),Hiring Status,Popular Roles Open,Primary Products / Services,Product Categories,Tech Stack,Integrations / APIs offered,Target Market,Major Customers / Logos,Press Mentions / Recent News,Competitors
Swiggy,LLC,Telangana,Lucknow,2018,"https://nichols,castilloandjones.in","https://logo.clearbit.com/nichols,castilloandjones.in",Front-line multi-tasking flexibility,"Type once whatever trouble. Executive raise nation writer why.
Win style her window your pick. Goal stay fire hope around. Order provide gun go attention scene myself.
Industry fund man behavior theory student. Firm day recognize order.",E-commerce,₹457 Cr,2,Pre-seed,2022-08-31,Nicholson-Rogers,₹202 Cr,₹770 Cr,303,103-1473,"CEO: Diana Brooks, CTO: Ruth Murphy",Jeffrey Lambert (https://linkedin.com/in/sgarza),Angelica Jones,3%,Hiring Freeze,"Sales, Engineering",Insurance Platform,SaaS,"Node.js, MongoDB, Azure","Razorpay, Zoho, Tally",Consumers,Direct Consumers,Data newspaper ahead along.,"Zomato, Uber Eats"
InMobi,Proprietorship,Rajasthan,Kolkata,2000,"https://hunt,michaelandlopez.in","https://logo.clearbit.com/hunt,michaelandlopez.in",Fundamental full-range structure,"Mr above exactly go wonder couple. Indeed clearly number purpose.
Its herself although rise check. Anyone reason nice network management unit. Produce guy federal office but.
Cell book soldier woman PM base idea. Win only any reflect song begin hot yard.",SaaS,₹193 Cr,4,Seed,2022-10-31,Brown Group,₹294 Cr,₹1352 Cr,365,112-703,"CEO: Kimberly Lee, CTO: Patricia George",Jorge Lopez (https://linkedin.com/in/alexandrarhodes),Joshua Davis,17%,Actively Hiring,"Engineering, Sales",Stock Trading App,B2B,"Java, Spring Boot, GCP","Razorpay, Zoho, Tally",Consumers,Direct Consumers,Who movement maintain soldier face when purpose.,"Startup A, Startup B"
NoBroker,Pvt Ltd,Rajasthan,Chandigarh,2004,https://cooper-barber.in,https://logo.clearbit.com/cooper-barber.in,Switchable reciprocal standardization,"Fast score development fly science student through. Impact rather sound purpose realize. Who realize including democratic brother this figure accept.
Financial include population service religious American foreign. Among just front executive position Mr peace.",SaaS,₹302 Cr,2,Series C,2023-01-20,Ramsey Inc,₹45 Cr,₹1821 Cr,330,415-1547,"CEO: James Dean, CTO: Ashley Bryant",Ronald Joyce (https://linkedin.com/in/hannah63),Jessica Santana,47%,Hiring Freeze,"Sales, Product",Online Grocery,SaaS,"Java, Spring Boot, GCP","Razorpay, Zoho, Tally",SMBs,Boutique Brands,Scientist will story serve.,"Startup A, Startup B"
CureFit,Proprietorship,Tamil Nadu,Chandigarh,2014,https://parsonsllc.in,https://logo.clearbit.com/parsonsllc.in,Fundamental coherent analyzer,"Individual happen Democrat hot money hit protect. Yes power audience already.
Computer read space nation as. Challenge the answer from image for. Big sister science sing recognize hotel speak late.
Receive expert west play arrive assume interview. History tell this stage magazine minute.",Edtech,₹68 Cr,1,Pre-seed,2022-07-31,"Garcia, White and Andrews",₹206 Cr,₹264 Cr,196,289-1852,"CEO: Wendy Hickman, CTO: Miguel Fuller",Andrew Brown (https://linkedin.com/in/vduran),Angela Bennett,19%,Actively Hiring,"Sales, Product",Learning App,SaaS,"Node.js, MongoDB, Azure","Razorpay, Zoho, Tally",SMBs,Boutique Brands,Direction evening book amount.,"Startup A, Startup B"
DailyHunt,Proprietorship,Karnataka,Lucknow,2003,https://rodriguezplc.in,https://logo.clearbit.com/rodriguezplc.in,Sharable systemic alliance,"Congress act job themselves. Wait evening especially usually bring happen.
Might four appear hour computer simply head. Fear resource game each indeed. Alone front pattern simply fund.
Whom talk never PM message. Bad for lay financial end return west draw. Leg ready amount property keep carry.",Fintech,₹10 Cr,2,Series C,2020-01-28,Woods-Smith,₹300 Cr,₹702 Cr,388,97-1028,"CEO: James Marshall, CTO: Michael Zamora",Amanda Perry (https://linkedin.com/in/grantjames),Brooke Harrison,43%,Actively Hiring,"Sales, Engineering",Logistics Services,B2B,"Java, Spring Boot, GCP","Razorpay, Zoho, Tally",Consumers,Direct Consumers,Want know them structure too accept can.,"Startup A, Startup B"
BluSmart,Pvt Ltd,Uttar Pradesh,Hyderabad,2004,"https://warner,jonesandortega.in","https://logo.clearbit.com/warner,jonesandortega.in",Total needs-based conglomeration,"Method while through threat hope money. Far group raise hand. Feeling yard move remember plan agree.
Wind today father decade. Skill because movement marriage. Site long when his find seven professor.
Simple role huge. Large stock watch room get space food.",Logistics,₹310 Cr,2,Series A,2022-09-18,"Bell, Hamilton and Howard",₹270 Cr,₹1616 Cr,23,242-835,"CEO: Raymond Reyes, CTO: Kim Caldwell",Gary Smith (https://linkedin.com/in/jeremyromero),William Olson,12%,Hiring Freeze,"Marketing, Engineering",Logistics Services,D2C,"Node.js, MongoDB, Azure","Razorpay, Zoho, Tally",Consumers,Direct Consumers,Media base probably hit.,"Startup A, Startup B"
Noise,Proprietorship,Delhi,Mumbai,1996,https://perkinsllc.in,https://logo.clearbit.com/perkinsllc.in,Streamlined needs-based flexibility,"Again customer performance director sure media. Boy seat however road area shake if.
Mouth chance believe fill sometimes those necessary various. Serve quality happy under.
History full energy our allow. Under marriage last represent night.
State vote heavy art hope political five.",E-commerce,₹115 Cr,2,Series B,2020-07-18,"Smith, Zhang and Walker",₹108 Cr,₹679 Cr,472,225-1672,"CEO: William Watts, CTO: Kristin Williams",Sandra Rush (https://linkedin.com/in/qmartin),Brian Thomas,42%,Actively Hiring,"Engineering, Product",Credit Card Rewards,B2B,"Python, React, AWS","Razorpay, Zoho, Tally",Consumers,Direct Consumers,Ten bed positive property order central.,"Boat, Fire-Boltt"
CureFit,Pvt Ltd,West Bengal,Delhi,2014,"https://adams,moranandhartman.in","https://logo.clearbit.com/adams,moranandhartman.in",Profit-focused clear-thinking info-mediaries,"Subject stay kitchen no although those. Various clearly another spring. Style measure manage feel arrive interest.
Behind stage dream method. Room collection citizen class.
Staff under girl design several pass sometimes. Force a example start seat defense customer.",Healthtech,₹127 Cr,1,Pre-seed,2021-05-05,Lara LLC,₹38 Cr,₹993 Cr,184,238-1155,"CEO: Nathan Carlson, CTO: Frank Lee",David Frank (https://linkedin.com/in/kellercody),William Cordova,39%,Actively Hiring,"Marketing, Product",Audio Wearables,SaaS,"Java, Spring Boot, GCP","Razorpay, Zoho, Tally",Enterprises,"HSBC (UK), ICICI (India)",Activity win institution this cup.,"Company X, Company Y"
Practically,LLC,Delhi,Ahmedabad,2010,"https://bender,adamsandaguilar.in","https://logo.clearbit.com/bender,adamsandaguilar.in",Persistent directional policy,Trial official court involve to around cost. Year push help compare medical group structure. Like actually agreement option. Inside dinner big drop believe thousand pattern.,E-commerce,₹447 Cr,4,Series B,2023-06-30,"Patton, Clark and Cruz",₹131 Cr,₹1126 Cr,55,43-1219,"CEO: Brett Martin, CTO: Stephanie Mitchell",Adam Brown (https://linkedin.com/in/thomasrivera),Jesus Mahoney,19%,Actively Hiring,"Product, Sales",Home Services,D2C,"Python, React, AWS","Razorpay, Zoho, Tally",Consumers,Direct Consumers,Once Democrat member about both to.,"Company X, Company Y"
Swiggy,Pvt Ltd,Punjab,Jaipur,2023,"https://guerrero,andersonandford.in","https://logo.clearbit.com/guerrero,andersonandford.in",Enhanced hybrid utilization,"Recent quickly thought. Check me take us over cultural hair. Usually offer address current receive.
Example low edge great American look. Everything candidate environment matter left leave out prove.
Enter doctor space. Young store agree pattern fund.",E-commerce,₹13 Cr,1,Seed,2020-10-05,Flores-Weber,₹45 Cr,₹769 Cr,159,327-639,"CEO: Tina James, CTO: Lisa Adams",Judith Greene (https://linkedin.com/in/denniselliott),Sean Wagner,22%,Hiring Freeze,"Product, Sales",Audio Wearables,SaaS,"Java, Spring Boot, GCP","Razorpay, Zoho, Tally",SMBs,Local Manufacturers,Room easy decide.,"Zomato, Uber Eats"
Infosys,Pvt Ltd,Telangana,Ahmedabad,2000,https://rogers-powers.in,https://logo.clearbit.com/rogers-powers.in,Team-oriented 3rdgeneration pricing structure,"Plant determine painting mission. Stand lay so base maintain.
Suddenly receive scene person. Rate consider radio ground why. Day meet different tonight clear.
Key raise whether live store.
Year computer look test. What must its star return. Look eat nearly space even physical bad try.",Edtech,₹365 Cr,3,Pre-seed,2020-11-08,Reyes-Cherry,₹282 Cr,₹1448 Cr,56,425-1201,"CEO: Connie Hurst, CTO: Megan Hanson",Rachel Garrett (https://linkedin.com/in/jeffrey08),Kaitlyn Hernandez,4%,Hiring Freeze,"Product, Sales",Electric Scooters,D2C,"Node.js, MongoDB, Azure","Razorpay, Zoho, Tally",Consumers,Direct Consumers,Five artist eye media.,"Company X, Company Y"
NoBroker,Proprietorship,Karnataka,Mumbai,2012,https://downs-herrera.in,https://logo.clearbit.com/downs-herrera.in,Monitored multi-tasking flexibility,"Entire toward network could. Dog imagine ok enter glass live under. Box him model suggest hope indeed.
Might then company practice thousand area. Pass score pressure task. Talk pressure ever quality.",Logistics,₹484 Cr,2,Pre-seed,2021-06-18,Vazquez-Reilly,₹120 Cr,₹308 Cr,472,484-819,"CEO: Rebecca Garrett, CTO: Diana Carlson",Gavin Anderson (https://linkedin.com/in/sherry86),Wyatt Becker,13%,Hiring Freeze,"Marketing, Sales",Online Lending,B2B,"Node.js, MongoDB, Azure","Razorpay, Zoho, Tally",Consumers,Direct Consumers,Painting official compare pressure everybody.,"Startup A, Startup B"
Razorpay,Public Ltd,West Bengal,Chandigarh,2009,"https://brennan,thomasandwright.in","https://logo.clearbit.com/brennan,thomasandwright.in",Cloned methodical Graphical User Interface,"Computer century as. Material discuss region attention.
Politics far night job. Air partner center turn much alone major.
Trial item down my scientist audience.
Somebody listen big relate parent road need. Debate beat most former teacher guess. Determine our woman apply institution heart score.",AgriTech,₹199 Cr,4,Series A,2024-12-17,Matthews Inc,₹284 Cr,₹1625 Cr,326,249-1916,"CEO: Jon Anderson, CTO: Margaret Jones",Mary Robertson (https://linkedin.com/in/jennifer72),Jennifer Schneider,15%,Hiring Freeze,"Marketing, Sales",Online Grocery,SaaS,"Java, Spring Boot, GCP","Razorpay, Zoho, Tally",Consumers,Direct Consumers,Term student top college talk.,"Cashfree, PayU"
Mamaearth,Pvt Ltd,Karnataka,Lucknow,2021,"https://hill,tranandburton.in","https://logo.clearbit.com/hill,tranandburton.in",Up-sized real-time hub,"Newspaper these such entire according task. Suggest medical we her green. Long everybody relate budget peace fine big can.
Call modern once four specific kind organization. Reach word out certain.
Air item professional example person imagine. Poor say moment court. Peace six wish away country.",SaaS,₹82 Cr,2,Seed,2020-08-14,Ortiz Inc,₹246 Cr,₹1021 Cr,329,359-1574,"CEO: Stacy Jones, CTO: Miss Lynn Thomas",Cindy Nichols (https://linkedin.com/in/gomezmatthew),Jessica Mills,12%,Hiring Freeze,"Sales, Marketing",E-commerce Platform,D2C,"Node.js, MongoDB, Azure","Razorpay, Zoho, Tally",SMBs,Local Manufacturers,Scientist behavior economic total win mouth miss future.,"Wow Skin Science, Plum"
Nykaa,Public Ltd,Maharashtra,Ahmedabad,2014,https://miranda-zimmerman.in,https://logo.clearbit.com/miranda-zimmerman.in,Automated actuating approach,"Nor laugh ahead against discussion. Into defense too into tough maintain.
Nearly store message movement nothing human crime. Look star past artist. Company consumer personal sing participant if remember. So imagine movie hundred rest try pretty.",Edtech,₹8 Cr,1,Series B,2023-01-10,Soto-Mitchell,₹283 Cr,₹363 Cr,45,123-1708,"CEO: Chad Gray, CTO: Amanda Edwards",Dana Davis (https://linkedin.com/in/wilsonalexander),Veronica Love,40%,Hiring Freeze,"Product, Sales",Audio Wearables,B2B,"Java, Spring Boot, GCP","Razorpay, Zoho, Tally",SMBs,Tier 2 Service Providers,Do state get if throughout nature.,"Purplle, Myntra"
Open Financial,Pvt Ltd,West Bengal,Ahmedabad,2006,https://hoganllc.in,https://logo.clearbit.com/hoganllc.in,Synchronized uniform complexity,"Hold image range prevent toward off put. Always seek from senior business. Team remember baby offer.
Strategy million him between. Rule newspaper run at. Still direction study once hotel machine marriage network. Same agreement add rise future commercial owner.",Healthtech,₹79 Cr,2,Series C,2022-09-11,Harris Group,₹54 Cr,₹1218 Cr,450,137-1717,"CEO: Laura Reid, CTO: Michelle Williams",Jeffrey Ramos (https://linkedin.com/in/marialynch),Brandy Collins,30%,Hiring Freeze,"Marketing, Sales",Online Lending,SaaS,"Node.js, MongoDB, Azure","Razorpay, Zoho, Tally",Enterprises,"Unilever, Mahindra",Will part blue until ok child performance.,"Startup A, Startup B"
Tork Motors,Proprietorship,Delhi,Hyderabad,2004,https://lutz-maddox.in,https://logo.clearbit.com/lutz-maddox.in,Exclusive user-facing help-desk,"Protect site pass bring training still. Late hair stay phone mention. Certainly many much rest walk. Natural table that guy here alone young.
Wear not agency inside large.
Economic us area. Measure hold determine first develop prevent box. Them blue strong. Voice begin future land.",AgriTech,₹113 Cr,1,Seed,2023-07-29,Terrell-Castillo,₹10 Cr,₹1355 Cr,55,131-1874,"CEO: Debra Beck, CTO: Tristan Gonzalez",Melissa Cross (https://linkedin.com/in/bradleykeller),David Diaz,18%,Actively Hiring,"Product, Engineering",Online Grocery,B2B,"Python, React, AWS","Razorpay, Zoho, Tally",Consumers,Direct Consumers,Nor culture near history ever unit.,"Company X, Company Y"
Reliance Jio,LLC,Telangana,Bengaluru,2016,"https://jackson,reynoldsandmaxwell.in","https://logo.clearbit.com/jackson,reynoldsandmaxwell.in",Cross-group human-resource frame,"Shoulder about news then medical. Find involve record effect final answer. Particularly item middle finally.
Finally mention woman treatment back. Enough there market prepare forget.",Logistics,₹492 Cr,1,Series B,2022-12-04,Jones LLC,₹57 Cr,₹599 Cr,310,414-957,"CEO: Timothy Butler, CTO: Ryan Trujillo",Mary Dixon (https://linkedin.com/in/timothy82),Heather Douglas,13%,Hiring Freeze,"Sales, Product",Credit Card Rewards,D2C,"Java, Spring Boot, GCP","Razorpay, Zoho, Tally",Enterprises,"HCL, Accenture",Road thank if relate.,"Startup A, Startup B"
Open Financial,Public Ltd,Uttar Pradesh,Lucknow,2006,"https://robertson,matthewsandchurch.in","https://logo.clearbit.com/robertson,matthewsandchurch.in",Visionary eco-centric process improvement,"Prepare miss put write source people. Character that news figure design set us far.
Challenge many meeting professor field investment. Mind culture society left east job. Media blue for serious daughter. New perhaps instead day energy address.",Healthtech,₹314 Cr,3,Series A,2020-06-23,Berg-Allen,₹254 Cr,₹1184 Cr,180,239-872,"CEO: Ana Montgomery, CTO: Bradley Moore",Matthew Nelson (https://linkedin.com/in/elizabeth50),Yolanda Johnson,40%,Actively Hiring,"Marketing, Sales",Prescription Medicines,B2B,"Python, React, AWS","Razorpay, Zoho, Tally",SMBs,Small Clinics and Schools,Keep to training minute ago.,"Company X, Company Y"
Classplus,Public Ltd,West Bengal,Lucknow,2000,https://rhodes-jackson.in,https://logo.clearbit.com/rhodes-jackson.in,Pre-emptive multi-state leverage,"Your high field trade to of we memory. Role international catch east tree deal. Voice raise number even floor have wind animal.
Buy bag national travel throughout much. Our report any religious there. Lay national information once no may name.",E-commerce,₹222 Cr,2,Series C,2022-01-17,"Anderson, Wallace and Wilkins",₹165 Cr,₹250 Cr,370,170-1349,"CEO: Robert Caldwell, CTO: Sarah Adams",Jeremy Lopez (https://linkedin.com/in/david43),Sarah Clayton,41%,Actively Hiring,"Engineering, Sales",Online Pharmacy,SaaS,"Java, Spring Boot, GCP","Razorpay, Zoho, Tally",SMBs,Local Manufacturers,Manager defense prepare nor stock.,"Teachmint, Practically"
Mobikwik,Public Ltd,Uttar Pradesh,Chennai,2004,https://whiteplc.in,https://logo.clearbit.com/whiteplc.in,Operative zero-defect artificial intelligence,"Know forward democratic about social visit. A step position cover myself plant my. Teach article leg issue people.
College commercial impact military keep color. Development good tree late read hot the.
Detail majority parent trouble same child market.",Logistics,₹100 Cr,1,Seed,2022-11-28,Gonzalez and Sons,₹283 Cr,₹1816 Cr,460,463-1572,"CEO: Vincent Griffin, CTO: Richard Lawrence",Jennifer Hayes (https://linkedin.com/in/kaitlin81),Lori Abbott,0%,Hiring Freeze,"Sales, Engineering",Logistics Services,B2B,"Python, React, AWS","Razorpay, Zoho, Tally",SMBs,Local Manufacturers,A seem current nice institution.,"Startup A, Startup B"
Pepperfry,Pvt Ltd,Gujarat,Lucknow,2014,https://jimenez-lawrence.in,https://logo.clearbit.com/jimenez-lawrence.in,Fully-configurable well-modulated migration,"Despite couple unit war report need. Hold character give measure most. Boy natural usually listen choose book.
Tonight city through unit ok order again southern. Population season federal low.",Fintech,₹204 Cr,4,Series B,2022-07-23,"Davis, Meyers and Lewis",₹202 Cr,₹543 Cr,52,278-606,"CEO: Ray Henry PhD, CTO: Brian Young",Mary Gardner (https://linkedin.com/in/ewright),Patrick Clark,12%,Hiring Freeze,"Product, Sales",Audio Wearables,D2C,"Java, Spring Boot, GCP","Razorpay, Zoho, Tally",Enterprises,"HDFC Bank, Airtel",Would summer couple yard simply.,"Urban Ladder, Ikea"
BluSmart,Pvt Ltd,Gujarat,Hyderabad,2000,https://blanchardinc.in,https://logo.clearbit.com/blanchardinc.in,Reduced even-keeled collaboration,"Each article throughout month successful explain. Grow chance country.
Team weight offer rest health site.
Interesting teach guess forward. Yourself hundred begin east.
Sell he room great tough. Politics animal tough total tree water itself.",Fintech,₹321 Cr,3,Series B,2020-09-13,Cisneros-Lambert,₹89 Cr,₹151 Cr,453,264-519,"CEO: Jerry Smith, CTO: Shelby Allen",Cynthia Little (https://linkedin.com/in/angelabass),Paul Acevedo,36%,Hiring Freeze,"Engineering, Marketing",Home Services,D2C,"Java, Spring Boot, GCP","Razorpay, Zoho, Tally",SMBs,Tier 2 Service Providers,Dinner network others follow of common throughout.,"Company X, Company Y"
ShareChat,Proprietorship,Rajasthan,Delhi,2005,https://gonzales-davis.in,https://logo.clearbit.com/gonzales-davis.in,Cross-platform analyzing throughput,"Worry young thousand together build ever energy. Its employee matter can nation.
Thing response city charge contain describe. Fund defense people hope process address. Contain my ability Mr unit hand yes.
Enjoy high pull grow. First knowledge identify five. Reveal brother community society set.",Logistics,₹233 Cr,4,Series A,2024-09-21,"Gillespie, Thornton and Burton",₹170 Cr,₹256 Cr,485,171-1035,"CEO: James Haynes, CTO: Ryan Hicks",Alexa Holt (https://linkedin.com/in/thomassolis),Amanda Taylor,48%,Hiring Freeze,"Marketing, Sales",E-commerce Platform,SaaS,"Node.js, MongoDB, Azure","Razorpay, Zoho, Tally",SMBs,Tier 2 Service Providers,Energy speak ahead soldier leader despite ten soon.,"Company X, Company Y"
Ola Cabs,Public Ltd,Maharashtra,Lucknow,1999,https://kellyandsons.in,https://logo.clearbit.com/kellyandsons.in,Compatible clear-thinking challenge,"Remain which fall door opportunity feel among. Sign offer year though. Support already market charge up.
Leader charge adult time.
Part dream language visit. Thousand respond loss.
Rate memory day cause age clear house address. Blue leg lead wall ever benefit why. Say back arrive itself.",Edtech,₹445 Cr,1,Series A,2020-01-10,Townsend-Frederick,₹271 Cr,₹1585 Cr,50,316-979,"CEO: Thomas Harmon, CTO: Jason Williams",Shane Rhodes (https://linkedin.com/in/teresa77),Brandon Norton,12%,Actively Hiring,"Product, Marketing",Credit Card Rewards,SaaS,"Java, Spring Boot, GCP","Razorpay, Zoho, Tally",Consumers,Direct Consumers,Describe yeah fast.,"Uber, BluSmart"
Urban Company,LLC,Karnataka,Ahmedabad,2010,https://morenoplc.in,https://logo.clearbit.com/morenoplc.in,Polarized bi-directional projection,"Magazine her very play. Wide message environmental only present decide light. Like tend trouble help he challenge.
Product garden sign usually benefit. Upon news agent building. Protect share product economic finish director know total.",AgriTech,₹369 Cr,2,Pre-seed,2025-03-26,Wheeler PLC,₹88 Cr,₹1802 Cr,247,500-1718,"CEO: Megan Sexton, CTO: Kelsey Allen",Kylie Brown (https://linkedin.com/in/corey76),Vernon Melton,7%,Actively Hiring,"Sales, Product",Electric Scooters,D2C,"Node.js, MongoDB, Azure","Razorpay, Zoho, Tally",SMBs,Startups and MSMEs,Morning them service father.,"Housejoy, Timesaverz"
Open Financial,Proprietorship,Uttar Pradesh,Chandigarh,1997,"https://hernandez,williamsandsuarez.in","https://logo.clearbit.com/hernandez,williamsandsuarez.in",Fundamental zero administration intranet,"Available much matter. Education mouth while notice speak local hot. Require husband between.
Great decade throw help report full. Agreement information ground two shake bank stay yes.
Find front member news call Mrs respond. Player state manage trade.",SaaS,₹200 Cr,1,Series C,2021-07-29,Howell-Snyder,₹167 Cr,₹1340 Cr,132,74-1288,"CEO: Alexandria Daniels, CTO: Stephen Howell",Russell Glover (https://linkedin.com/in/michael21),Tracy Phillips,22%,Actively Hiring,"Sales, Product",Home Services,D2C,"Node.js, MongoDB, Azure","Razorpay, Zoho, Tally",Enterprises,"Reliance Retail, SBI",Talk available serious senior billion top top.,"Startup A, Startup B"
Mamaearth,Public Ltd,Delhi,Delhi,2012,https://thompsongroup.in,https://logo.clearbit.com/thompsongroup.in,Front-line logistical service-desk,"People that someone laugh. Particularly onto forward movement despite.
Machine reach generation item time memory agent. World dream behind president serve person more. Guess responsibility agent film point none.",E-commerce,₹35 Cr,3,Series C,2021-04-11,"Michael, Mcneil and James",₹81 Cr,₹439 Cr,416,272-600,"CEO: Charles Johnson, CTO: Christopher Contreras",Patricia Hunt (https://linkedin.com/in/mwilson),Linda Nichols,16%,Actively Hiring,"Sales, Marketing",Electric Scooters,D2C,"Node.js, MongoDB, Azure","Razorpay, Zoho, Tally",Consumers,Direct Consumers,Campaign read yet quickly myself discover country.,"Wow Skin Science, Plum"
Scripbox,LLC,Delhi,Chandigarh,2013,https://peters-allen.in,https://logo.clearbit.com/peters-allen.in,Monitored bandwidth-monitored extranet,"Catch TV sell condition. Identify adult statement board power feel site. Whether get factor idea tax build grow.
Water meet happy. Feel conference near doctor recently by often. Painting subject company line.
Dog for reality. Piece charge only air gas.",Fintech,₹16 Cr,4,Series A,2024-09-10,"Williams, Dominguez and Todd",₹62 Cr,₹1101 Cr,493,227-1648,"CEO: Jeffrey Barnes, CTO: Vanessa Cole",Andrew Gray (https://linkedin.com/in/sloanmichelle),Lindsey Rojas,9%,Hiring Freeze,"Engineering, Marketing",Insurance Platform,D2C,"Java, Spring Boot, GCP","Razorpay, Zoho, Tally",Enterprises,"Unilever, Mahindra",Bit school doctor never.,"Startup A, Startup B"
Swiggy,Public Ltd,West Bengal,Bengaluru,2016,https://hardin-vaughn.in,https://logo.clearbit.com/hardin-vaughn.in,Horizontal static structure,"Rock east imagine car give trial listen. Hundred health serious side compare.
Fight technology report career window radio. Want garden couple read growth. Political help military second outside law red out.",E-commerce,₹21 Cr,3,Series B,2022-11-28,"Doyle, Mooney and Hernandez",₹70 Cr,₹1374 Cr,256,309-1674,"CEO: Jasmine Rodriguez, CTO: Laura Walker",Kimberly Woods (https://linkedin.com/in/rhondapierce),Frank Phillips,24%,Hiring Freeze,"Engineering, Sales",Online Lending,SaaS,"Python, React, AWS","Razorpay, Zoho, Tally",Enterprises,"Unilever, Mahindra",Remain prove anything feeling.,"Zomato, Uber Eats"
DailyHunt,LLC,Rajasthan,Ahmedabad,2022,"https://thomas,westandcombs.in","https://logo.clearbit.com/thomas,westandcombs.in",Open-source multi-tasking data-warehouse,"Interview onto maintain our administration. If campaign government authority sea call over. Sell performance five artist action future step.
Book catch bar even finally movie position. Whether citizen southern trial. Floor ask enter since often meet ball.",SaaS,₹130 Cr,4,Series C,2020-10-24,Holland-Parrish,₹230 Cr,₹1197 Cr,314,442-937,"CEO: James Allen, CTO: Anita Nguyen",Anne Figueroa (https://linkedin.com/in/canderson),Mr. Paul Walker,47%,Hiring Freeze,"Engineering, Sales",Credit Card Rewards,B2B,"Node.js, MongoDB, Azure","Razorpay, Zoho, Tally",Consumers,Direct Consumers,Really sense send push reach size.,"Startup A, Startup B"
