Snapdeal,Public Ltd,Telangana,Ahmedabad,2023,"https://salas,floydandprice.in","https://logo.clearbit.com/salas,floydandprice.in",Horizontal well-modulated budgetary management,"Cell player scientist. We available high trial everyone sit. Memory our entire once author. Rock ball should hand professor since could.
Heavy indicate spring together image environmental. Paper suddenly through industry bring daughter.",AgriTech,₹4 Cr,4,Pre-seed,2023-09-24,Quinn LLC,₹167 Cr,₹1588 Cr,371,373-1465,"CEO: Jermaine Jackson, CTO: Zachary Harper",Corey Silva (https://linkedin.com/in/bakertaylor),Christopher Everett,38%,Actively Hiring,"Sales, Marketing",Food Delivery,D2C,"Node.js, MongoDB, Azure","Razorpay, Zoho, Tally",Enterprises,"Flipkart, Tata Group",Subject young teacher civil first age per.,"Company X, Company Y"
Classplus,Public Ltd,Delhi,Mumbai,2009,https://harrisllc.in,https://logo.clearbit.com/harrisllc.in,Synchronized reciprocal productivity,"Shoulder nor bill still. Memory trial role only.
Trade drop notice back provide. Model goal garden large.
Listen table focus us position fear player red. Tonight partner parent class theory. Practice feeling degree or.",Edtech,₹115 Cr,1,Series A,2022-08-14,Valenzuela-Garcia,₹74 Cr,₹1480 Cr,26,174-650,"CEO: Molly Hill, CTO: Sharon Clark",Ronald Compton (https://linkedin.com/in/amymurphy),Matthew Jackson,42%,Hiring Freeze,"Product, Marketing",Stock Trading App,SaaS,"Node.js, MongoDB, Azure","Razorpay, Zoho, Tally",Enterprises,"Flipkart, Tata Group",Compare almost charge another.,"Teachmint, Practically"
Reliance Jio,Public Ltd,Delhi,Ahmedabad,2020,https://leonardltd.in,https://logo.clearbit.com/leonardltd.in,Profound global hardware,"Recent piece whose end end old.
Think market speech final. Face any fine top arrive. Half notice none lead modern quite fact set.
Ask herself hear president arrive morning. Yourself soon certain prove science how participant.",E-commerce,₹477 Cr,3,Series B,2022-01-13,"Bowman, Cooper and Reed",₹170 Cr,₹815 Cr,47,186-1779,"CEO: Shawn Thornton, CTO: Alfred Robles",Vanessa Smith (https://linkedin.com/in/adamsdonna),Richard Johnson,25%,Hiring Freeze,"Engineering, Marketing",Home Services,SaaS,"Node.js, MongoDB, Azure","Razorpay, Zoho, Tally",Enterprises,"HSBC (UK), ICICI (India)",Along seven become mention.,"Startup A, Startup B"
Ather Energy,Public Ltd,Rajasthan,Jaipur,2021,https://hernandezandsons.in,https://logo.clearbit.com/hernandezandsons.in,Operative hybrid forecast,"Employee recent sing property information. Field his cell determine will degree between. Above hope what.
Feeling measure morning rock may. Almost car young history particularly lot front.",E-commerce,₹146 Cr,1,Series C,2023-07-19,"Watts, Ho and Bentley",₹272 Cr,₹1661 Cr,455,32-1328,"CEO: Lisa Diaz, CTO: Scott Adams",Eric Wilson (https://linkedin.com/in/duncanjeffrey),Karen Bradford,11%,Actively Hiring,"Sales, Marketing",Online Grocery,D2C,"Python, React, AWS","Razorpay, Zoho, Tally",SMBs,Local Kirana Stores,Mrs site sign assume.,"Company X, Company Y"
Ather Energy,Pvt Ltd,Uttar Pradesh,Delhi,2021,https://carrillogroup.in,https://logo.clearbit.com/carrillogroup.in,Operative local strategy,"Guess fill positive small. Hope become choose.
Teacher media red compare until. For Mrs your expect itself over education. Letter positive fire place.
Visit account true eight. Bar international order attention economic result.",AgriTech,₹412 Cr,2,Seed,2020-12-30,Thompson Ltd,₹167 Cr,₹1238 Cr,122,446-1674,"CEO: Aaron Diaz, CTO: Dr. Rachel Wood",Janet Tucker (https://linkedin.com/in/ehunt),Lindsey Melton,39%,Hiring Freeze,"Sales, Product",AI Chatbot Tools,B2B,"Python, React, AWS","Razorpay, Zoho, Tally",SMBs,Small Clinics and Schools,Opportunity war brother character in page.,"Startup A, Startup B"
CRED,Public Ltd,Delhi,Jaipur,1995,"https://scott,jacksonandmoses.in","https://logo.clearbit.com/scott,jacksonandmoses.in",Programmable hybrid approach,"Quality themselves war she cold relate under. Himself now style itself seven. Control expert or ago after good.
Quickly real news drug area.
Air among himself buy consumer. Develop life large carry many any social. Thousand president true maybe number.",Logistics,₹315 Cr,2,Series C,2024-02-09,"Smith, Ward and Holland",₹292 Cr,₹1405 Cr,68,22-883,"CEO: Christian Underwood, CTO: Brian Stephens",Andrew Osborne (https://linkedin.com/in/hoganraymond),Holly Curry,17%,Hiring Freeze,"Product, Engineering",Audio Wearables,SaaS,"Python, React, AWS","Razorpay, Zoho, Tally",Consumers,Direct Consumers,Recognize whom discussion information.,"Company X, Company Y"
1mg,Proprietorship,Punjab,Delhi,2013,"https://young,evansandbell.in","https://logo.clearbit.com/young,evansandbell.in",Compatible client-server project,"Now sort throw everyone yard to. Professor visit physical thing oil his. Through hit herself ten question a who. Result message effect vote represent.
Blood meet above third team knowledge meeting something.",SaaS,₹220 Cr,2,Series C,2020-10-09,"Wilson, Smith and Bradshaw",₹199 Cr,₹1365 Cr,72,463-1716,"CEO: Connor Shannon, CTO: Linda Smith",Steven Graham (https://linkedin.com/in/marisa77),Alexandra Clarke,10%,Actively Hiring,"Marketing, Product",Electric Scooters,D2C,"Java, Spring Boot, GCP","Razorpay, Zoho, Tally",Consumers,Direct Consumers,Clear common big blood total.,"Startup A, Startup B"
Flipkart,LLC,Punjab,Hyderabad,2008,https://ballardgroup.in,https://logo.clearbit.com/ballardgroup.in,Multi-layered clear-thinking algorithm,"Answer close position soon. Ago for garden everyone year.
Ground event expect family behavior decide. Purpose article capital continue. Past information partner enter general class.
Card government past sure understand. Magazine only very decision person leader. Mrs tell low serious option.",Edtech,₹80 Cr,2,Series B,2021-09-07,"Warren, Gibson and Allen",₹300 Cr,₹509 Cr,76,299-1448,"CEO: Manuel Long, CTO: Paul Bennett",John Vaughn (https://linkedin.com/in/nwhite),Timothy Jones,19%,Hiring Freeze,"Engineering, Sales",Electric Scooters,D2C,"Python, React, AWS","Razorpay, Zoho, Tally",Enterprises,"HCL, Accenture",Chair this source against rise.,"Amazon, Meesho"
NoBroker,Pvt Ltd,Tamil Nadu,Delhi,2010,https://colon-daniel.in,https://logo.clearbit.com/colon-daniel.in,Configurable multi-state archive,"Also page relationship force officer all they north. Walk technology because number buy.
Animal ever town firm computer. Eye other face major mother cut.
Weight know many. Idea image people successful star. Give show improve kid throw note force.",Fintech,₹11 Cr,4,Seed,2020-08-15,Perry LLC,₹33 Cr,₹1459 Cr,398,378-1139,"CEO: Jason Casey, CTO: Robert Phillips",Rachel Martin (https://linkedin.com/in/ujohnson),Michelle Ryan,11%,Actively Hiring,"Marketing, Sales",Furniture Marketplace,D2C,"Java, Spring Boot, GCP","Razorpay, Zoho, Tally",Consumers,Direct Consumers,Teach south across forget various.,"Startup A, Startup B"
InMobi,Pvt Ltd,Karnataka,Chandigarh,2013,"https://simpson,robertsandavila.in","https://logo.clearbit.com/simpson,robertsandavila.in",Organized well-modulated alliance,"Program investment civil shake none community true rock. Somebody follow line reveal. Democratic energy chair today do strategy stay.
Option deep very many pretty economy. Part law practice process prevent we answer.",Logistics,₹376 Cr,1,Series A,2022-01-26,Knight-Smith,₹281 Cr,₹130 Cr,370,181-1588,"CEO: Tara Kirby, CTO: Steven Brown",David Snyder (https://linkedin.com/in/vincent29),Frank Garza,4%,Actively Hiring,"Engineering, Product",Online Lending,B2B,"Java, Spring Boot, GCP","Razorpay, Zoho, Tally",SMBs,Independent Pharmacies,Change system north have mother note.,"Company X, Company Y"
PhonePe,Pvt Ltd,Rajasthan,Chennai,2014,https://martininc.in,https://logo.clearbit.com/martininc.in,Profound secondary instruction set,"Into reach American reach throughout act positive. Professional I modern clearly author sister color resource.
Spring heavy near add less. Total stay lay general finish price.
Wear second process section establish. Pattern move long drug stand top I.
Manage area goal exist. Sure movement natural.",Edtech,₹318 Cr,3,Series C,2020-09-29,"Martin, Wood and Reid",₹177 Cr,₹1154 Cr,265,399-989,"CEO: Belinda Hancock, CTO: Richard Rivera",Dustin Williams (https://linkedin.com/in/jweber),Steven Young,44%,Hiring Freeze,"Engineering, Sales",Electric Scooters,D2C,"Python, React, AWS","Razorpay, Zoho, Tally",Consumers,Direct Consumers,Light morning generation.,"Paytm, Google Pay"
BigBasket,Proprietorship,Karnataka,Chandigarh,2015,"https://hartman,huffandmiller.in","https://logo.clearbit.com/hartman,huffandmiller.in",Advanced client-server website,"Son rather officer shake.
Case strategy goal what training trouble. Although compare out arm similar already.
Each than party player house training team. Could wide tend citizen.
Fear customer them try pass. It free student.
Each week race individual. Tax exactly put.
Those reduce represent war.",Healthtech,₹150 Cr,1,Seed,2021-08-17,Herrera-Riddle,₹99 Cr,₹652 Cr,405,336-1137,"CEO: Christopher Robertson, CTO: Calvin Davis II",Alex Poole (https://linkedin.com/in/gabrielle08),Belinda Ward,33%,Actively Hiring,"Sales, Product",Fashion Retail,SaaS,"Python, React, AWS","Razorpay, Zoho, Tally",Enterprises,"TCS, Infosys (India)",Environmental little building expert act concern trouble.,"Grofers, JioMart"
Navi,Proprietorship,Karnataka,Jaipur,2000,"https://good,rhodesandfisher.in","https://logo.clearbit.com/good,rhodesandfisher.in",Open-source attitude-oriented open system,"Lot evening particularly machine movement network. Agree will together doctor involve center.
Apply seek seem simply. Result special wear. Hard unit standard reach support according song.
Rest imagine miss card window goal. Travel hard policy partner teach citizen eye. Choose area moment window.",Fintech,₹366 Cr,4,Pre-seed,2022-02-01,"Martin, Gonzalez and Herrera",₹149 Cr,₹106 Cr,387,310-1347,"CEO: Anna Garcia, CTO: George Hayes",Sheila Garcia (https://linkedin.com/in/michael63),Rebekah Reyes,37%,Hiring Freeze,"Marketing, Product",Furniture Marketplace,SaaS,"Python, React, AWS","Razorpay, Zoho, Tally",Enterprises,"Unilever, Mahindra",Lot here owner left risk.,"Startup A, Startup B"
ShareChat,Pvt Ltd,Rajasthan,Chandigarh,2010,https://floresinc.in,https://logo.clearbit.com/floresinc.in,Profound 6thgeneration alliance,"Sport son reflect player imagine check full. Station show challenge. Entire particular book contain sort less.
Drop appear front democratic ten. Treatment themselves soon everyone campaign coach individual. Decade institution character theory never.",Edtech,₹493 Cr,2,Series A,2020-08-30,Green-Harris,₹42 Cr,₹1439 Cr,277,376-1390,"CEO: Mary Lawson, CTO: Michelle Hernandez",Allison Brown (https://linkedin.com/in/nlowery),Amanda Silva,46%,Actively Hiring,"Engineering, Sales",Online Lending,D2C,"Node.js, MongoDB, Azure","Razorpay, Zoho, Tally",Enterprises,"Flipkart, Tata Group",Model likely man name create college accept director.,"Startup A, Startup B"
Tork Motors,Pvt Ltd,Punjab,Mumbai,2009,"https://wise,lawsonandcox.in","https://logo.clearbit.com/wise,lawsonandcox.in",Intuitive regional intranet,"Because vote mention political. Animal together physical appear practice only still. Social rate toward media.
Try student senior war. Author off head sense she human computer. Weight whether common camera take.
Street final the real might sure east. Really whom home stock energy a.",SaaS,₹314 Cr,2,Series A,2022-01-10,Casey PLC,₹12 Cr,₹470 Cr,314,430-628,"CEO: Megan Moore, CTO: Lawrence Todd",Brian Cervantes (https://linkedin.com/in/amanda33),Kevin Simmons,8%,Actively Hiring,"Marketing, Product",Electric Scooters,SaaS,"Java, Spring Boot, GCP","Razorpay, Zoho, Tally",Consumers,Direct Consumers,Everyone so air reveal week seem.,"Startup A, Startup B"
Mamaearth,Pvt Ltd,Telangana,Lucknow,2022,"https://davis,wheelerandgarcia.in","https://logo.clearbit.com/davis,wheelerandgarcia.in",Realigned analyzing analyzer,"Team late doctor blood anyone yeah tree. Do us yes billion school.
Respond training attorney by cultural. Assume star hand late raise many step leg. Word radio order imagine.",Edtech,₹11 Cr,4,Series C,2021-08-16,"Coleman, Morrow and Reed",₹103 Cr,₹1870 Cr,441,431-629,"CEO: Thomas Avila, CTO: Daniel James",Katie Navarro (https://linkedin.com/in/edward78),Matthew Pace,50%,Hiring Freeze,"Sales, Engineering",Ride Hailing,B2B,"Java, Spring Boot, GCP","Razorpay, Zoho, Tally",Consumers,Direct Consumers,Force local third hear step.,"Wow Skin Science, Plum"
Ather Energy,Pvt Ltd,Maharashtra,Kolkata,2001,https://medina-bridges.in,https://logo.clearbit.com/medina-bridges.in,Adaptive context-sensitive Local Area Network,"Trip their bad enter message keep new. Address guy table clearly example artist test. Fight and set particularly join. Research this final within.
Light recently production chair share. Follow dog world Congress building.
Fire although particularly second produce. While recognize market.",Healthtech,₹227 Cr,1,Pre-seed,2024-12-12,"Garner, Morris and Weiss",₹151 Cr,₹776 Cr,235,114-885,"CEO: Angela Mcgee, CTO: Darrell Rangel",Brandon Miller (https://linkedin.com/in/laurenjohns),David Reid,6%,Hiring Freeze,"Sales, Product",Health and Fitness App,B2B,"Python, React, AWS","Razorpay, Zoho, Tally",Enterprises,"Flipkart, Tata Group",Dinner rate personal impact movement concern base.,"Startup A, Startup B"
Nykaa,Proprietorship,Uttar Pradesh,Bengaluru,1997,"https://wilson,haleyanddickson.in","https://logo.clearbit.com/wilson,haleyanddickson.in",Universal systematic implementation,"Simple somebody create site total beat. Activity form side religious state section yet.
Generation free actually tell food TV enough. Ok dinner laugh trial. Likely same main argue.
Place smile degree include environment pick career through. Only sell before effort actually road particular exist.",Edtech,₹272 Cr,4,Series B,2021-11-14,Green and Sons,₹296 Cr,₹1540 Cr,425,478-1421,"CEO: Shelby Benson, CTO: Wanda Moody",Ms. Karen Miller (https://linkedin.com/in/alicemclaughlin),Zachary Williams,31%,Hiring Freeze,"Engineering, Product",Audio Wearables,D2C,"Node.js, MongoDB, Azure","Razorpay, Zoho, Tally",Consumers,Direct Consumers,Particularly short reduce rock.,"Purplle, Myntra"
Groww,Pvt Ltd,Gujarat,Hyderabad,1998,"https://barr,obrienandmora.in","https://logo.clearbit.com/barr,obrienandmora.in",Implemented didactic leverage,"Eight imagine under role size beyond. Within away computer. Right personal eat baby amount.
Cut subject fill music when course. Accept check yard responsibility. Stock month later executive.
Next group catch. Movement work appear nice strong apply.
Number all quality again. Hold box late certain.",E-commerce,₹439 Cr,4,Series B,2023-10-18,Mitchell-Melton,₹294 Cr,₹942 Cr,368,492-1407,"CEO: Jerry Baldwin, CTO: Anthony Pearson",Maria Medina (https://linkedin.com/in/mhopkins),Darlene Thompson,3%,Actively Hiring,"Sales, Engineering",Credit Card Rewards,SaaS,"Java, Spring Boot, GCP","Razorpay, Zoho, Tally",Consumers,Direct Consumers,Your poor black agency office.,"Zerodha, Upstox"
HealthifyMe,Proprietorship,West Bengal,Kolkata,1999,https://danielsgroup.in,https://logo.clearbit.com/danielsgroup.in,Upgradable optimal Graphical User Interface,"As sing suffer through onto head. Personal serve individual.
Fill ball walk land. Significant skin research. Spring answer among discussion step successful focus and.
Hope food family. Knowledge owner keep read mean. Analysis left decade.",Healthtech,₹25 Cr,4,Series A,2024-12-16,Thompson-Cruz,₹55 Cr,₹390 Cr,414,299-521,"CEO: Scott Mitchell, CTO: Isabel Boyer",Linda Barrera (https://linkedin.com/in/zthompson),Shannon Wilson,36%,Actively Hiring,"Marketing, Engineering",Learning App,D2C,"Python, React, AWS","Razorpay, Zoho, Tally",Enterprises,"Flipkart, Tata Group",Land life style woman one voice.,"Cure.fit, MyFitnessPal"
Urban Company,Proprietorship,Maharashtra,Bengaluru,2006,"https://davis,vaughnandsantos.in","https://logo.clearbit.com/davis,vaughnandsantos.in",Customizable global success,"Author view prepare organization. Manager available eye fish.
Answer even such worry current.
Direction there order medical develop a. Clearly local poor majority believe success. Store easy everything hand fire.
That if any end life produce. Avoid prevent stock want. Play could travel.",AgriTech,₹314 Cr,4,Pre-seed,2021-01-13,Frey Inc,₹175 Cr,₹749 Cr,318,328-2000,"CEO: David Wood, CTO: Rachel Brown",Nicholas Shields (https://linkedin.com/in/tjordan),William Lopez,9%,Hiring Freeze,"Engineering, Sales",Job Search Platform,B2B,"Node.js, MongoDB, Azure","Razorpay, Zoho, Tally",Enterprises,"Reliance Retail, SBI",Board cell TV town medical gun.,"Housejoy, Timesaverz"
Pepperfry,LLC,Punjab,Bengaluru,2014,https://clarkllc.in,https://logo.clearbit.com/clarkllc.in,Multi-layered multimedia orchestration,"Good someone full share street chair black. Consider thing daughter also white available adult.
Teach partner center perform treat head. Note vote agreement believe. Very model another interest entire.
History yes record.
Better measure color perform consider daughter. Race important degree above.",SaaS,₹78 Cr,2,Pre-seed,2024-11-19,"Hawkins, Green and Owens",₹238 Cr,₹779 Cr,492,91-1591,"CEO: Elijah Guerra, CTO: Danny Reeves",Tyler Holt (https://linkedin.com/in/brownmichael),Jennifer Ramos,35%,Hiring Freeze,"Sales, Marketing",Stock Trading App,B2B,"Java, Spring Boot, GCP","Razorpay, Zoho, Tally",Enterprises,"TCS, Infosys (India)",Worry green cover.,"Urban Ladder, Ikea"
Ola Cabs,Proprietorship,Gujarat,Jaipur,2019,https://grayandsons.in,https://logo.clearbit.com/grayandsons.in,Horizontal optimizing analyzer,"Staff gas whom whatever evening. Up price several state. Group issue establish page director page respond serious.
Artist than age computer surface article. Fish executive industry cup artist. Ball your entire why standard site.
Partner may gas few open talk conference. Democratic expert consumer.",E-commerce,₹364 Cr,3,Series B,2023-11-19,Delgado Inc,₹172 Cr,₹414 Cr,462,448-1371,"CEO: Benjamin Hill, CTO: Jason Ewing",Michael Camacho (https://linkedin.com/in/gomezjuan),Holly Mcbride,34%,Hiring Freeze,"Marketing, Sales",Credit Card Rewards,B2B,"Python, React, AWS","Razorpay, Zoho, Tally",SMBs,Tier 2 Service Providers,Your onto report prevent something police.,"Uber, BluSmart"
Navi,LLC,Telangana,Bengaluru,2003,"https://perry,reynoldsandweaver.in","https://logo.clearbit.com/perry,reynoldsandweaver.in",Function-based leadingedge toolset,"Pretty investment either indicate son rock. Sign beautiful step it forward. Town hard kitchen particular serve.
Should focus western friend moment step. Quality drive right local piece word statement.
Safe walk girl agency feeling. Often garden end star site.",Healthtech,₹441 Cr,1,Series A,2022-08-11,Saunders-Peterson,₹5 Cr,₹1776 Cr,102,455-1827,"CEO: Richard Moore, CTO: Bradley Garza",William Williams (https://linkedin.com/in/krodriguez),Jason Lee,25%,Hiring Freeze,"Product, Engineering",Learning App,SaaS,"Python, React, AWS","Razorpay, Zoho, Tally",SMBs,Startups and MSMEs,Somebody just sister visit trial respond building.,"Startup A, Startup B"
Byju's,Public Ltd,Delhi,Ahmedabad,2019,"https://cruz,holmesandscott.in","https://logo.clearbit.com/cruz,holmesandscott.in",Down-sized tangible productivity,"Focus when sure nor. Chair already admit view effort month himself.
Sometimes process process minute trial food. Different market light reflect knowledge. Himself seat into report.
Population your tell make bed. Media kid high consumer minute.",SaaS,₹183 Cr,4,Series A,2020-10-31,Cooley-Calderon,₹140 Cr,₹337 Cr,306,344-877,"CEO: Marcus Davis, CTO: Kaitlyn Wallace",James Smith (https://linkedin.com/in/eburke),Dawn Hall,2%,Hiring Freeze,"Product, Sales",E-commerce Platform,D2C,"Node.js, MongoDB, Azure","Razorpay, Zoho, Tally",Consumers,Direct Consumers,Despite identify whether continue production couple energy.,"Unacademy, Vedantu"
Mobikwik,Public Ltd,Uttar Pradesh,Lucknow,2015,"https://montgomery,waltersandmorgan.in","https://logo.clearbit.com/montgomery,waltersandmorgan.in",Multi-channeled multi-tasking functionalities,"Space bring never leader. Research carry success nothing assume professional measure author. Develop green thank better.
Word mother produce talk probably. Election kind deep try recognize.",SaaS,₹196 Cr,4,Pre-seed,2021-06-17,"Weaver, Cooper and Goodwin",₹214 Cr,₹1161 Cr,485,438-827,"CEO: Tammy Smith, CTO: Autumn Jones",Sharon Carter (https://linkedin.com/in/porterbrian),Jenna Lutz,27%,Actively Hiring,"Sales, Product",Credit Card Rewards,D2C,"Node.js, MongoDB, Azure","Razorpay, Zoho, Tally",Consumers,Direct Consumers,Pull film up discussion represent herself loss past.,"Company X, Company Y"
Pepperfry,Pvt Ltd,West Bengal,Hyderabad,2001,"https://becker,adamsandsimmons.in","https://logo.clearbit.com/becker,adamsandsimmons.in",Pre-emptive transitional forecast,"Play girl finish present store yes budget. Concern method shoulder throw peace various attention.
Trouble summer child culture. Usually politics behavior several list identify.
Whose nice strategy find least positive rich. Any between few ball cup sit. Movie particularly not measure a side know.",Healthtech,₹408 Cr,3,Series C,2025-03-28,Salinas and Sons,₹24 Cr,₹852 Cr,84,483-1422,"CEO: Mary Summers, CTO: Erin Bray",Michael Norman (https://linkedin.com/in/andersonjeffrey),Brooke Lane,43%,Hiring Freeze,"Sales, Product",Health and Fitness App,SaaS,"Java, Spring Boot, GCP","Razorpay, Zoho, Tally",Enterprises,"HCL, Accenture",Finish main your baby treatment her effect focus.,"Urban Ladder, Ikea"
Infosys,Proprietorship,Punjab,Bengaluru,1999,https://johnsongroup.in,https://logo.clearbit.com/johnsongroup.in,Down-sized motivating website,"Artist gas friend tax. Probably reduce before subject sister let official apply. Ask write speech project by change training mouth.
Paper issue pretty story stock other successful. Figure long old exist. Ground material most Republican either local.",SaaS,₹322 Cr,2,Pre-seed,2021-07-25,Dunn-Hall,₹213 Cr,₹761 Cr,116,177-1162,"CEO: Luis Mcintosh, CTO: Chad Leonard",Ashley Parrish (https://linkedin.com/in/gpayne),Valerie Miller,29%,Hiring Freeze,"Sales, Engineering",Learning App,B2B,"Python, React, AWS","Razorpay, Zoho, Tally",Consumers,Direct Consumers,Total include least true research sell me pull.,"Company X, Company Y"
Scripbox,LLC,Delhi,Ahmedabad,1996,https://kimltd.in,https://logo.clearbit.com/kimltd.in,Re-engineered user-facing success,"Trial action animal worry common. Administration name alone quite them run small tonight. Society while newspaper purpose responsibility specific wife attack.
Product consider magazine reveal central. Political much get cover answer rich. Eat experience federal represent including certain save.",Logistics,₹398 Cr,1,Series C,2021-01-17,Wilson Ltd,₹251 Cr,₹1171 Cr,329,28-505,"CEO: Sarah Solomon, CTO: Jeffrey Lin",George Moore (https://linkedin.com/in/elizabeth14),Dennis Peterson,31%,Hiring Freeze,"Marketing, Engineering",Audio Wearables,B2B,"Python, React, AWS","Razorpay, Zoho, Tally",Enterprises,"Adani Group, Wipro",Main threat watch decision tough outside party.,"Company X, Company Y"
Practically,Public Ltd,Tamil Nadu,Jaipur,1997,https://hansoninc.in,https://logo.clearbit.com/hansoninc.in,Seamless static time-frame,"Life while job physical around loss skin organization. Exactly out card well author dog. Cut continue ground news defense current.
Politics carry expect million. Visit still environment true later week sister adult.",Fintech,₹174 Cr,3,Pre-seed,2024-02-17,Parsons-Houston,₹99 Cr,₹246 Cr,489,66-1271,"CEO: Henry Harrison, CTO: Jo Galloway",David Black (https://linkedin.com/in/hernandezchristopher),Michelle Luna,8%,Hiring Freeze,"Product, Engineering",Home Services,B2B,"Java, Spring Boot, GCP","Razorpay, Zoho, Tally",Enterprises,"Maruti Suzuki, Bosch",Rich physical happen price follow operation research.,"Startup A, Startup B"
Ola Cabs,LLC,Gujarat,Chennai,2005,https://valdezplc.in,https://logo.clearbit.com/valdezplc.in,Reduced incremental strategy,"Watch list myself leave few hand they. Goal spring ahead light size guess second year.
Discussion and word exactly. Man tonight improve fact avoid. Exactly central produce near issue little.
Fill ability kind employee happen able. Back TV nature discussion deal company.",Edtech,₹79 Cr,3,Series A,2021-06-06,"Munoz, Smith and Howard",₹130 Cr,₹875 Cr,392,26-785,"CEO: Mark Schroeder, CTO: Ashley Woodard",Sarah Cook (https://linkedin.com/in/zalvarez),Patrick Wells,7%,Hiring Freeze,"Sales, Marketing",Online Pharmacy,D2C,"Python, React, AWS","Razorpay, Zoho, Tally",SMBs,Tier 2 Service Providers,Natural energy culture pressure idea organization sometimes type.,"Uber, BluSmart"
Udaan,Public Ltd,Uttar Pradesh,Kolkata,2019,https://clarkplc.in,https://logo.clearbit.com/clarkplc.in,Quality-focused encompassing interface,"Exactly religious friend part. State democratic after.
Still hour save win through. Include friend grow whole. Rather none nor admit hundred identify.
Produce possible prove new. Pull wonder again name. Public sort tell suddenly listen.",Fintech,₹93 Cr,4,Seed,2025-03-05,Humphrey LLC,₹92 Cr,₹1219 Cr,493,56-726,"CEO: Michael Clark, CTO: Nicholas Huff",Kenneth Owens (https://linkedin.com/in/teresa53),Michael Graham,15%,Hiring Freeze,"Product, Engineering",AI Chatbot Tools,D2C,"Node.js, MongoDB, Azure","Razorpay, Zoho, Tally",SMBs,Regional Retailers,Church else end audience.,"Company X, Company Y"
