Ather Energy,Proprietorship,Maharashtra,Ahmedabad,2005,"https://gray,collinsandlopez.in","https://logo.clearbit.com/gray,collinsandlopez.in",Object-based reciprocal forecast,"Movie themselves close yes drug way. Production unit investment present another scene feeling physical.
Produce member any threat various face it. Republican side play true. Find news firm might wall yes customer.",Logistics,₹351 Cr,4,Series B,2022-05-03,"Wood, Howard and Scott",₹38 Cr,₹230 Cr,302,176-1665,"CEO: Morgan Smith, CTO: Stacy Hayes",Cindy Schultz (https://linkedin.com/in/matthewkerr),Teresa Johnson,43%,Hiring Freeze,"Product, Sales",Home Services,SaaS,"Python, React, AWS","Razorpay, Zoho, Tally",Consumers,Direct Consumers,Sport enough three sister them important challenge maybe.,"Company X, Company Y"
Boat,Public Ltd,Delhi,Bengaluru,2020,https://craig-weeks.in,https://logo.clearbit.com/craig-weeks.in,Distributed web-enabled benchmark,"International role present owner. Design budget interest remember suddenly choice. Own lot everything defense whatever enter home follow.
Rich hold box require camera know. Professional total degree purpose power. Source often fill adult. Wish television big situation agent large.",E-commerce,₹132 Cr,4,Seed,2021-01-16,"Jones, Smith and Pacheco",₹141 Cr,₹1085 Cr,185,107-1851,"CEO: Blake Zuniga, CTO: Sean Davies",James Campbell (https://linkedin.com/in/ysanchez),Anita Singh,35%,Hiring Freeze,"Sales, Product",AI Chatbot Tools,SaaS,"Java, Spring Boot, GCP","Razorpay, Zoho, Tally",SMBs,Local Kirana Stores,Organization feel strategy suddenly attack final control.,"Noise, JBL"
InMobi,Public Ltd,Punjab,Bengaluru,2021,https://travis-cooke.in,https://logo.clearbit.com/travis-cooke.in,Public-key disintermediate project,"Important keep including program. Service seek senior green appear turn. Though movement single.
Time owner ability teacher few son wait. Along risk expert against knowledge.
Home walk door box four office why set.",Fintech,₹152 Cr,3,Seed,2022-02-20,Rivera PLC,₹217 Cr,₹719 Cr,282,383-1966,"CEO: Matthew Callahan, CTO: Michelle Gomez",David Sullivan (https://linkedin.com/in/peterskimberly),Natalie Robinson,12%,Actively Hiring,"Product, Engineering",Health and Fitness App,D2C,"Node.js, MongoDB, Azure","Razorpay, Zoho, Tally",Enterprises,"HSBC (UK), ICICI (India)",Lawyer draw personal result officer.,"Startup A, Startup B"
NoBroker,LLC,West Bengal,Chandigarh,2001,"https://davis,gonzalezandlong.in","https://logo.clearbit.com/davis,gonzalezandlong.in",Robust 24/7 hub,"Weight free while rule western customer help. Field there sister decade democratic water. College after everybody skill chair arm identify.
Step our security suffer people individual. Country itself almost late easy. Bank wrong near.",Healthtech,₹423 Cr,4,Seed,2021-04-08,Lee-Allen,₹94 Cr,₹882 Cr,448,463-1667,"CEO: Elizabeth Carpenter, CTO: Lisa Mcdaniel",Suzanne Martinez (https://linkedin.com/in/kray),Adam Thompson,1%,Hiring Freeze,"Sales, Product",Furniture Marketplace,SaaS,"Node.js, MongoDB, Azure","Razorpay, Zoho, Tally",Enterprises,"HDFC Bank, Airtel",Writer ask share apply.,"Company X, Company Y"
Mobikwik,Proprietorship,West Bengal,Chandigarh,2016,"https://miller,wongandfarley.in","https://logo.clearbit.com/miller,wongandfarley.in",Optimized optimal concept,"Show read someone cost race baby. Father however place. Soldier phone student answer.
Risk rule sell seven kind of five. Front his hit forget tell free.
Doctor but character course need. Run property end soon determine draw. Likely window form threat act decision.",Healthtech,₹85 Cr,4,Seed,2023-10-03,"Saunders, Anderson and Henderson",₹249 Cr,₹1519 Cr,448,450-906,"CEO: Benjamin Villa, CTO: Nicole Carter",Terri Morgan (https://linkedin.com/in/kaitlyn74),Benjamin Wilcox,49%,Hiring Freeze,"Product, Sales",Prescription Medicines,B2B,"Node.js, MongoDB, Azure","Razorpay, Zoho, Tally",Consumers,Direct Consumers,Develop point concern art.,"Company X, Company Y"
Freshworks,Proprietorship,Punjab,Chandigarh,1996,https://williamson-russell.in,https://logo.clearbit.com/williamson-russell.in,Devolved mission-critical adapter,"Wall get wind field style. Computer enter peace treat trial. Truth near enjoy.
Seat seek memory. Ever discuss either quite medical.
Pass at letter moment decide.
Research lose several. How wrong only. Learn other assume laugh.
A Republican operation list plant. Newspaper little make even power.",SaaS,₹455 Cr,4,Series A,2025-03-29,"Hall, Lewis and Young",₹168 Cr,₹937 Cr,84,362-1403,"CEO: Jonathan Gillespie, CTO: Randy Smith",Corey Lee (https://linkedin.com/in/qroberts),Christine Evans,27%,Actively Hiring,"Sales, Product",Learning App,SaaS,"Java, Spring Boot, GCP","Razorpay, Zoho, Tally",Consumers,Direct Consumers,Reflect defense need blue nothing college.,"Zoho, Salesforce"
Tata Motors,LLC,Karnataka,Jaipur,1998,https://danielllc.in,https://logo.clearbit.com/danielllc.in,Centralized neutral matrix,"Much worker head language us. Agreement thus meeting bank.
Require discover me continue animal stop. Note light fine once record. Popular same fact nothing player sit third.
Amount mission head focus improve future nice want. Price agree into sign forward reality pull.",Edtech,₹44 Cr,4,Series A,2021-03-23,"Cortez, Nelson and Farrell",₹253 Cr,₹565 Cr,466,182-1960,"CEO: Andrew Mayer, CTO: Kimberly Villarreal",Daniel Lopez (https://linkedin.com/in/kyle54),Ronald Brown,18%,Hiring Freeze,"Marketing, Engineering",Online Pharmacy,B2B,"Node.js, MongoDB, Azure","Razorpay, Zoho, Tally",Consumers,Direct Consumers,Point should hundred.,"Company X, Company Y"
Swiggy,Public Ltd,Punjab,Bengaluru,2002,https://gillllc.in,https://logo.clearbit.com/gillllc.in,Ergonomic real-time algorithm,"Type address attack type strong herself. Dog recently concern upon game truth subject.
Yourself unit protect resource green common feeling. Table knowledge moment stay conference tree remain. Give suggest attention according push pull.
Dark travel likely baby view debate. Admit trouble skin name.",AgriTech,₹341 Cr,4,Pre-seed,2021-08-02,Wilkerson Ltd,₹90 Cr,₹1399 Cr,334,432-1988,"CEO: Richard Hill, CTO: Ashley Middleton",Paige Floyd (https://linkedin.com/in/amandagonzalez),Allison Christensen,2%,Hiring Freeze,"Engineering, Marketing",E-commerce Platform,D2C,"Java, Spring Boot, GCP","Razorpay, Zoho, Tally",Consumers,Direct Consumers,Across them skill take.,"Zomato, Uber Eats"
Ather Energy,Public Ltd,Delhi,Chandigarh,2001,https://richardson-skinner.in,https://logo.clearbit.com/richardson-skinner.in,Implemented real-time toolset,"Tonight reach thank. Skin include glass term.
Modern area our training third family. Act allow hair always not could debate actually. Down better hold theory but cup agent.
Yet this several war. Whom TV war.",Fintech,₹496 Cr,2,Series A,2023-05-18,"Morales, Sutton and Smith",₹157 Cr,₹1292 Cr,22,394-536,"CEO: Kenneth Adkins, CTO: William Ramirez",Kristine Baldwin (https://linkedin.com/in/george62),Albert Castillo,48%,Actively Hiring,"Product, Sales",Digital Payments,B2B,"Python, React, AWS","Razorpay, Zoho, Tally",Enterprises,"Unilever, Mahindra",Work book others head system.,"Startup A, Startup B"
Paytm,Public Ltd,Gujarat,Hyderabad,1999,https://lewis-richmond.in,https://logo.clearbit.com/lewis-richmond.in,Horizontal bottom-line task-force,"House season political office cost. Among assume cover boy ask add out president.
Same lawyer father. Myself strategy represent lead campaign network season protect.
There old maintain vote cover. Citizen crime guess success. Miss current open born.",SaaS,₹217 Cr,1,Series C,2024-01-19,"Rodriguez, Brooks and Bailey",₹161 Cr,₹1525 Cr,372,213-1397,"CEO: Brittany Anderson, CTO: Heather Perkins",Autumn Bishop (https://linkedin.com/in/janejohnson),Christine Matthews,8%,Actively Hiring,"Sales, Product",Health and Fitness App,D2C,"Node.js, MongoDB, Azure","Razorpay, Zoho, Tally",Enterprises,"Adani Group, Wipro",Think ahead recognize fire beautiful.,"PhonePe, Google Pay"
Urban Company,Proprietorship,Karnataka,Delhi,2010,https://marshall-carter.in,https://logo.clearbit.com/marshall-carter.in,Robust human-resource challenge,"Look and little. Voice plant new. Follow though several me.
Work to go range argue. Order near water will. Mrs later interesting technology produce your plant.
Practice position minute carry left image. Anyone message south. Find if remember true.",AgriTech,₹63 Cr,4,Seed,2022-09-18,Martin-Smith,₹222 Cr,₹1858 Cr,319,229-1009,"CEO: Lindsey Allen, CTO: Kimberly Wyatt",Justin Peterson (https://linkedin.com/in/brian65),Kevin Bell,35%,Actively Hiring,"Marketing, Engineering",Electric Scooters,D2C,"Node.js, MongoDB, Azure","Razorpay, Zoho, Tally",SMBs,Tier 2 Service Providers,Anyone middle state not people at ever parent.,"Housejoy, Timesaverz"
Pepperfry,LLC,West Bengal,Ahmedabad,2021,https://sheltonandsons.in,https://logo.clearbit.com/sheltonandsons.in,Switchable regional artificial intelligence,"Last deal might population exactly voice. With interesting rock loss trade wind.
Able face grow customer program. Others exactly five first style we. Collection answer friend shoulder their wind how.",AgriTech,₹313 Cr,1,Seed,2024-10-02,"Valdez, Howell and Johnson",₹247 Cr,₹938 Cr,422,254-1812,"CEO: James Ferrell, CTO: Bruce Gaines",Ralph Wallace (https://linkedin.com/in/gwallace),Jason Diaz,22%,Actively Hiring,"Engineering, Product",Insurance Platform,B2B,"Java, Spring Boot, GCP","Razorpay, Zoho, Tally",Consumers,Direct Consumers,Skill weight past course watch second.,"Urban Ladder, Ikea"
Tork Motors,Proprietorship,Gujarat,Chennai,2020,https://kelly-cox.in,https://logo.clearbit.com/kelly-cox.in,Cross-platform coherent orchestration,"Tonight nation real speak too organization example. Very yes cut none song form boy. Size board positive bit sit.
Fund everyone natural before born. Defense face north.",E-commerce,₹152 Cr,2,Seed,2024-05-28,Green-Taylor,₹200 Cr,₹1703 Cr,100,326-1878,"CEO: Zachary Brown, CTO: Ana Kirk",Jacqueline Collins (https://linkedin.com/in/tedwards),Ashley Oconnor,49%,Hiring Freeze,"Product, Sales",Fashion Retail,SaaS,"Node.js, MongoDB, Azure","Razorpay, Zoho, Tally",Consumers,Direct Consumers,Put threat simply list religious board yeah.,"Startup A, Startup B"
Myntra,Public Ltd,Punjab,Bengaluru,2010,https://collins-wade.in,https://logo.clearbit.com/collins-wade.in,Virtual client-driven installation,"Join leg consider dark inside me score. Series run student say main meeting. Laugh ahead better hospital rather huge.
Fill across manage particular anyone. School view order law eye along.
Conference blood tonight three city. Despite president with term magazine push.",Logistics,₹367 Cr,2,Series C,2020-06-10,Griffin Group,₹201 Cr,₹362 Cr,470,442-873,"CEO: Brian Gonzales, CTO: Trevor Wilson",Priscilla Jones (https://linkedin.com/in/aaronsingleton),Margaret Diaz,15%,Actively Hiring,"Marketing, Product",Online Lending,SaaS,"Java, Spring Boot, GCP","Razorpay, Zoho, Tally",Consumers,Direct Consumers,Father occur Republican during.,"Startup A, Startup B"
Ola Cabs,LLC,Telangana,Bengaluru,2007,https://wilsonandsons.in,https://logo.clearbit.com/wilsonandsons.in,Public-key bandwidth-monitored encoding,"Full challenge western. Game of reduce travel trip state. Meeting fine gun wait teacher available hand. Impact major give until defense dinner.
Standard indeed respond understand their. Red yes eight standard.
Can else already trip.",AgriTech,₹30 Cr,2,Seed,2023-03-02,"Costa, Nichols and Chavez",₹17 Cr,₹1270 Cr,306,496-987,"CEO: Jonathan Mitchell, CTO: Aaron Nicholson",Troy Campbell (https://linkedin.com/in/vlee),Julia Church,4%,Actively Hiring,"Marketing, Sales",AI Chatbot Tools,SaaS,"Java, Spring Boot, GCP","Razorpay, Zoho, Tally",SMBs,Regional Retailers,Never own east claim player manager though.,"Uber, BluSmart"
Boat,Public Ltd,Punjab,Delhi,2006,https://perezinc.in,https://logo.clearbit.com/perezinc.in,Cross-platform background conglomeration,"Truth would party. Term level plan model maybe process.
Recent information for. Economy good other. Who program forget body. Police moment eight threat gas.
Law night similar evening condition bit try nothing. Opportunity effect often weight care.",E-commerce,₹422 Cr,4,Series B,2021-09-05,"Johnson, Gamble and Mack",₹156 Cr,₹1262 Cr,103,97-1302,"CEO: Michael Williams, CTO: April Castillo",John Lewis (https://linkedin.com/in/hursttracy),Scott Garcia,46%,Hiring Freeze,"Sales, Engineering",Food Delivery,SaaS,"Python, React, AWS","Razorpay, Zoho, Tally",Consumers,Direct Consumers,Federal fly sea tough one pick hotel.,"Noise, JBL"
Urban Company,Pvt Ltd,West Bengal,Chennai,2017,https://greenegroup.in,https://logo.clearbit.com/greenegroup.in,Digitized executive time-frame,"View road success energy film vote. Health child even view.
Draw foot soon.
Despite affect even yard. Like class here.
Democrat plan employee out none. Remain or international long off hand shake.
Old pull mention white include hold. Knowledge huge wish smile finish chair energy.",SaaS,₹442 Cr,3,Series C,2023-08-18,Stevenson-Hines,₹40 Cr,₹1251 Cr,58,300-969,"CEO: Victor Edwards, CTO: Richard Booker DDS",Kimberly Cannon (https://linkedin.com/in/laurierobinson),Timothy Davidson,6%,Actively Hiring,"Sales, Product",Furniture Marketplace,B2B,"Node.js, MongoDB, Azure","Razorpay, Zoho, Tally",Consumers,Direct Consumers,Research community price raise tonight.,"Housejoy, Timesaverz"
Flipkart,Public Ltd,Telangana,Lucknow,2010,"https://stuart,hermanandcarroll.in","https://logo.clearbit.com/stuart,hermanandcarroll.in",Fully-configurable eco-centric Internet solution,"Buy figure save admit response. Situation enter such past vote. Help what could hair.
Personal organization future author write. Discussion read probably continue avoid easy.
Central physical keep rise describe.",Logistics,₹142 Cr,2,Series A,2022-10-02,"Higgins, Glass and Garcia",₹220 Cr,₹1130 Cr,206,184-869,"CEO: Jonathan Anderson, CTO: Hailey Fischer",Theresa Martin (https://linkedin.com/in/kirbywalter),Kyle Manning,46%,Hiring Freeze,"Product, Engineering",Prescription Medicines,B2B,"Python, React, AWS","Razorpay, Zoho, Tally",Consumers,Direct Consumers,Stop both already sell level former.,"Amazon, Meesho"
Udaan,Proprietorship,Maharashtra,Chandigarh,2022,"https://oliver,pattersonandmarks.in","https://logo.clearbit.com/oliver,pattersonandmarks.in",Down-sized 24/7 archive,"Yet specific could throw recently. Run wind pretty better read main lot.
Development cover care bit long enjoy girl. Toward current environment value someone born hard.
Source large itself machine. Production often international factor notice sit daughter. Mrs behavior marriage Mrs two authority.",Edtech,₹335 Cr,3,Series B,2021-02-16,Sanchez Ltd,₹177 Cr,₹789 Cr,119,19-1919,"CEO: Selena Chung, CTO: Samuel Stafford",Jennifer Bailey (https://linkedin.com/in/jonathan94),Michael Lee,3%,Actively Hiring,"Product, Marketing",Stock Trading App,SaaS,"Python, React, AWS","Razorpay, Zoho, Tally",SMBs,Tier 2 Service Providers,Establish poor hand.,"Company X, Company Y"
Lenskart,Public Ltd,Delhi,Hyderabad,2013,"https://gonzalez,hunterandbaker.in","https://logo.clearbit.com/gonzalez,hunterandbaker.in",Triple-buffered didactic software,"Name relationship raise country radio your fine. Green imagine serve myself.
Blood response project clear. With clear across activity drop movie great. Financial available recognize his.",Edtech,₹224 Cr,4,Series A,2025-04-11,Lucero Group,₹77 Cr,₹1865 Cr,41,371-919,"CEO: Justin Sanchez, CTO: Jacqueline Miller",Melissa Rice (https://linkedin.com/in/torrestracy),Felicia Carr,50%,Hiring Freeze,"Product, Sales",Home Services,SaaS,"Java, Spring Boot, GCP","Razorpay, Zoho, Tally",Enterprises,"Maruti Suzuki, Bosch",Food into act arm.,"Titan Eyeplus, Coolwinks"
DailyHunt,LLC,Tamil Nadu,Delhi,2002,https://danielgroup.in,https://logo.clearbit.com/danielgroup.in,Implemented impactful archive,"Expect effect recognize drug.
Person movie record expect able. Practice success fill early well loss. Keep at compare draw trouble may particularly.
Bar expect wear mean enough.
Reduce tough place out. Personal myself vote day strong enough.
Art bad yard financial many into total.",AgriTech,₹149 Cr,3,Series B,2024-02-26,Jefferson Group,₹43 Cr,₹1213 Cr,276,318-1603,"CEO: Monica Mitchell, CTO: Bryce Cox",Sandra Chavez (https://linkedin.com/in/carolynjohnson),Anthony Campbell,1%,Hiring Freeze,"Marketing, Sales",Digital Payments,B2B,"Python, React, AWS","Razorpay, Zoho, Tally",Enterprises,"Maruti Suzuki, Bosch",Camera wish parent scientist last attorney.,"Startup A, Startup B"
Lenskart,Pvt Ltd,Tamil Nadu,Hyderabad,2013,"https://frey,williamsonandbaker.in","https://logo.clearbit.com/frey,williamsonandbaker.in",Re-engineered asymmetric functionalities,"Single customer appear recent.
Suggest someone his television under each. Develop agreement side Democrat hope story. Top later worker four spend opportunity.
Say rather start. Remain decade cultural story. Property either name country understand.",E-commerce,₹168 Cr,3,Pre-seed,2020-09-08,"Bruce, Allen and Patterson",₹21 Cr,₹1145 Cr,465,88-1098,"CEO: Daniel Martin, CTO: Timothy Benson",Kevin Williams (https://linkedin.com/in/millerrachel),Heather Sharp,34%,Hiring Freeze,"Product, Engineering",Digital Payments,SaaS,"Java, Spring Boot, GCP","Razorpay, Zoho, Tally",SMBs,Startups and MSMEs,Stop number television office a.,"Titan Eyeplus, Coolwinks"
Mamaearth,Proprietorship,Karnataka,Chandigarh,2018,https://luna-stephenson.in,https://logo.clearbit.com/luna-stephenson.in,Fully-configurable bi-directional application,"Make several seem provide data visit use. He military garden group four order boy surface.
Bad fear want garden enough. Parent theory not continue level produce.
Single sort might tree authority admit. Reach chair parent reflect exist. Soon economy rock left article really trip society.",SaaS,₹2 Cr,1,Series B,2023-03-12,"Clark, Wilson and Glenn",₹46 Cr,₹1054 Cr,84,325-1847,"CEO: Michael Brown, CTO: Bryan Andrews",Paula Miller (https://linkedin.com/in/fmiller),Alexander Kemp,43%,Actively Hiring,"Product, Sales",Online Grocery,D2C,"Python, React, AWS","Razorpay, Zoho, Tally",Consumers,Direct Consumers,Fine inside product.,"Wow Skin Science, Plum"
Byju's,LLC,Delhi,Kolkata,2022,https://sandoval-hamilton.in,https://logo.clearbit.com/sandoval-hamilton.in,Business-focused neutral help-desk,"Create there sort require subject issue real. Along miss whatever west three. Or series should others issue appear management.
Politics discuss everything action sense paper. Power beat approach seat. Why enough big free speech media upon. Business commercial pretty take real recognize effect.",AgriTech,₹208 Cr,3,Series A,2021-06-15,Miller-Ramos,₹210 Cr,₹118 Cr,112,447-509,"CEO: Katrina Baldwin, CTO: Michele Ramsey",Amanda Wright (https://linkedin.com/in/qreynolds),Nancy Martinez,6%,Actively Hiring,"Product, Marketing",Learning App,D2C,"Java, Spring Boot, GCP","Razorpay, Zoho, Tally",Consumers,Direct Consumers,Consumer business soon him claim anyone.,"Unacademy, Vedantu"
Ola Cabs,LLC,Uttar Pradesh,Bengaluru,2023,https://mooreltd.in,https://logo.clearbit.com/mooreltd.in,Multi-channeled composite core,"Surface move owner fast million ago. Think mean training never.
Cause positive few method. Point around Democrat training. Writer fight travel matter.
Outside share street family film change discover put. Discuss small feel building machine black. Level sing must color defense body reach.",Healthtech,₹183 Cr,4,Pre-seed,2022-04-04,Hanson PLC,₹234 Cr,₹455 Cr,348,344-1357,"CEO: Carolyn Martin, CTO: Kelly Thomas",Mr. Donald Ford (https://linkedin.com/in/melissamatthews),Angela Diaz,47%,Hiring Freeze,"Sales, Marketing",Electric Scooters,SaaS,"Java, Spring Boot, GCP","Razorpay, Zoho, Tally",SMBs,Regional Retailers,Appear age special but writer whose employee court.,"Uber, BluSmart"
Infosys,Pvt Ltd,Telangana,Ahmedabad,1997,https://le-vargas.in,https://logo.clearbit.com/le-vargas.in,Decentralized upward-trending artificial intelligence,"Artist foot them while class eat character. Reality floor serious respond.
Bill increase stand front. Through doctor they former.
Still cost politics hot avoid box word. Newspaper officer yourself later turn anyone. Business whom rule visit police section. Drive through benefit action total.",Healthtech,₹497 Cr,3,Seed,2024-09-11,Turner-Anthony,₹122 Cr,₹1467 Cr,240,359-1421,"CEO: Timothy Gonzalez, CTO: Mackenzie Martin",Chelsea Martinez (https://linkedin.com/in/ghall),Andrea Murphy,41%,Hiring Freeze,"Sales, Product",Logistics Services,B2B,"Node.js, MongoDB, Azure","Razorpay, Zoho, Tally",SMBs,Tier 2 Service Providers,Finish whom this series similar receive.,"Startup A, Startup B"
Infosys,Public Ltd,Delhi,Kolkata,2000,"https://powell,cisnerosandwilson.in","https://logo.clearbit.com/powell,cisnerosandwilson.in",Exclusive well-modulated service-desk,"Already about executive assume spring which. Economic job few.
Fight accept almost fine. Similar defense free.
Yeah seven many card. Become image resource partner in eat.
Feel improve can say. Able forget among better year.",Logistics,₹89 Cr,1,Series A,2020-06-25,"Nguyen, Ruiz and Terrell",₹216 Cr,₹293 Cr,491,55-1174,"CEO: Johnny Miller, CTO: Andre Young",Abigail Beltran (https://linkedin.com/in/william57),Anna Brown,14%,Hiring Freeze,"Sales, Marketing",Home Services,B2B,"Java, Spring Boot, GCP","Razorpay, Zoho, Tally",Consumers,Direct Consumers,Account win story card behavior size prevent her.,"Company X, Company Y"
Navi,Public Ltd,Uttar Pradesh,Mumbai,2017,https://curry-bonilla.in,https://logo.clearbit.com/curry-bonilla.in,Up-sized analyzing time-frame,"Follow occur offer music sort base shake. Feeling party enough carry discussion experience wonder.
Believe establish later minute almost. Senior one recently tree source. Wear high threat daughter large stage.
Approach meeting gun. Provide society establish.",E-commerce,₹490 Cr,1,Series B,2024-10-16,Black PLC,₹77 Cr,₹568 Cr,186,208-829,"CEO: Elizabeth Smith, CTO: Jeremy Sims",Kevin Sanchez (https://linkedin.com/in/gwilliams),Gabriella Young,5%,Actively Hiring,"Sales, Product",Furniture Marketplace,D2C,"Node.js, MongoDB, Azure","Razorpay, Zoho, Tally",Enterprises,"Unilever, Mahindra",Include he employee reach fly star unit.,"Company X, Company Y"
Ather Energy,Pvt Ltd,Punjab,Delhi,2021,https://brewerplc.in,https://logo.clearbit.com/brewerplc.in,Fully-configurable regional extranet,"Lot tax skin physical again growth current. Food partner there new school.
Together last meeting fear interview too. Garden from ahead author money card stuff. Professional edge draw try.
Subject thank speech former himself nature.",SaaS,₹190 Cr,4,Series C,2024-06-05,Martinez PLC,₹172 Cr,₹1600 Cr,95,259-1090,"CEO: Stacey Sullivan, CTO: Leslie Myers",Timothy Valenzuela (https://linkedin.com/in/tomriley),Victoria Palmer,26%,Actively Hiring,"Product, Sales",Ride Hailing,D2C,"Node.js, MongoDB, Azure","Razorpay, Zoho, Tally",SMBs,Regional Retailers,Position drop land cover month every hundred.,"Startup A, Startup B"
Tata Motors,Pvt Ltd,Punjab,Delhi,2023,https://hester-smith.in,https://logo.clearbit.com/hester-smith.in,Synergistic hybrid help-desk,"Probably Congress student author future central wrong quite.
Lose form laugh game almost either wind.
Pressure say beat choose agree life matter trial. Physical much race image poor.
Kind make us experience artist. Although group star manager prove a everything stand.",E-commerce,₹42 Cr,1,Series C,2024-02-22,Grant PLC,₹289 Cr,₹1116 Cr,264,196-1493,"CEO: Victoria Johnson, CTO: Julia Perry",Kristin Rosario (https://linkedin.com/in/rebecca22),Crystal Peters,32%,Actively Hiring,"Product, Engineering",AI Chatbot Tools,SaaS,"Node.js, MongoDB, Azure","Razorpay, Zoho, Tally",SMBs,Boutique Brands,Pattern want individual than political whose.,"Company X, Company Y"
Practically,Pvt Ltd,Maharashtra,Lucknow,1997,https://rowe-white.in,https://logo.clearbit.com/rowe-white.in,Front-line impactful knowledgebase,"Art staff skin yard suffer. Store former foreign. Recognize people education step pattern hit.
Debate buy cup similar upon its north. Local audience buy. Physical often effect fast shake.
Bad total success culture level. Spring couple respond star him camera force decide.",Fintech,₹140 Cr,3,Seed,2022-10-26,"Campbell, Miller and Macdonald",₹94 Cr,₹1219 Cr,457,161-1319,"CEO: Carlos Brooks, CTO: Melanie Kim",Victor Lawrence (https://linkedin.com/in/kochtodd),Courtney Johnson,41%,Hiring Freeze,"Marketing, Sales",Stock Trading App,D2C,"Python, React, AWS","Razorpay, Zoho, Tally",SMBs,Small Clinics and Schools,Free value artist stop bad effect movement.,"Startup A, Startup B"
NoBroker,Pvt Ltd,Telangana,Ahmedabad,2017,https://johnson-white.in,https://logo.clearbit.com/johnson-white.in,Optimized grid-enabled alliance,"Paper for ok fall same section tax. Western network compare Congress.
Watch sit nor. Yes affect glass may course.
College seven public. Sit exist someone quality name go carry choose.
Leave street degree think keep. Likely hold skill energy. I with girl understand.",Healthtech,₹183 Cr,2,Series A,2024-07-10,Lewis Inc,₹262 Cr,₹1605 Cr,146,81-1697,"CEO: Sara Sanders, CTO: Ricky Stevenson",Jason Wilson (https://linkedin.com/in/bookertimothy),Taylor Hayes,3%,Actively Hiring,"Product, Marketing",Online Grocery,D2C,"Python, React, AWS","Razorpay, Zoho, Tally",SMBs,Local Manufacturers,Order model great mean mother defense remember ok.,"Startup A, Startup B"
